{
  "subsystem_genome_version": "subsystem_genome.v1",
  "identity": {
    "gene": "perception_lane_organ",
    "version": "0.1.0-concept",
    "stage": "governed",
    "display_name": "Perception Lane Organ"
  },
  "governance": {
    "contracts": [
      "docs/contracts/AAIS_SSP_PROTOCOL.md",
      "docs/contracts/AAIS_SSP_PROMOTION_PROTOCOL.md",
      "docs/contracts/AAIS_SUBSYSTEM_GENOME.md",
      "docs/contracts/AAIS_SUBSYSTEM_MUTATION_PATH.md",
      "docs/contracts/AAIS_SUBSYSTEM_RETIREMENT_PROTOCOL.md"
    ],
    "invariants": [
      "Read-only v1 \u2014 organ does not mutate upstream authority",
      "module_id frozen to AAIS-PLO-01"
    ]
  },
  "schema": {
    "ref": "schemas/perception_lane_organ.v1.json",
    "frozen": true
  },
  "runtime": {
    "surface": [
      {
        "kind": "module",
        "path": "src/perception_lane_organ.py"
      },
      {
        "kind": "api",
        "path": "GET /api/jarvis/perception-lane/status"
      },
      {
        "kind": "gate",
        "path": "make perception-lane-organ-gate"
      }
    ]
  },
  "proof": {
    "bundles": [
      "docs/proof/platform/PERCEPTION_LANE_ORGAN_GOVERNED_PROOF.md"
    ],
    "posture": "governed",
    "target_bundles": [
      "docs/proof/platform/PERCEPTION_LANE_ORGAN_V1_PROOF.md"
    ]
  },
  "lineage": {
    "parents": [
      "mystic_engine_organ",
      "spatial_reasoning_organ"
    ],
    "children": [
      "route_choice_organ"
    ]
  },
  "activation": {
    "order": 6,
    "batch_id": "alt14-summon-wave-2026-06",
    "notes": "Alt-14 wave 6"
  },
  "retirement": {
    "path": "docs/contracts/AAIS_SUBSYSTEM_RETIREMENT_PROTOCOL.md"
  },
  "mutation": {
    "history": []
  },
  "ssp": {
    "concept_spec": "docs/_future/ideas_pending/PERCEPTION_LANE_ORGAN.md",
    "mvp_plan": "docs/_future/ideas_pending/PERCEPTION_LANE_ORGAN_MVP_PLAN.md",
    "summon_eligible": false,
    "active_doc": "docs/subsystems/platform/PERCEPTION_LANE_ORGAN.md"
  }
}
