{
  "subsystem_genome_version": "subsystem_genome.v1",
  "identity": {
    "gene": "invariant_engine_organ",
    "version": "0.1.0-concept",
    "stage": "governed",
    "display_name": "Invariant Engine Organ"
  },
  "governance": {
    "contracts": [
      "docs/contracts/AAIS_SSP_PROTOCOL.md",
      "docs/contracts/AAIS_SSP_PROMOTION_PROTOCOL.md",
      "docs/subsystems/nova/NOVA_AI_OPERATING_CONTRACT.md",
      "docs/contracts/AAIS_SUBSYSTEM_MUTATION_PATH.md",
      "docs/contracts/AAIS_SUBSYSTEM_RETIREMENT_PROTOCOL.md"
    ],
    "invariants": [
      "Read-only Nova runtime compare \u2014 no autonomous BLOCK",
      "nova_runtime_consumer attestation on companion path",
      "Fail closed on missing bridge context"
    ]
  },
  "schema": {
    "ref": "schemas/invariant_engine_organ.v1.json",
    "frozen": true
  },
  "runtime": {
    "surface": [
      {
        "kind": "module",
        "path": "src/invariant_engine_organ.py"
      },
      {
        "kind": "api",
        "path": "GET /api/jarvis/invariant-engine/status"
      },
      {
        "kind": "gate",
        "path": "make invariant-engine-organ-gate"
      }
    ]
  },
  "proof": {
    "bundles": [
      "docs/proof/platform/INVARIANT_ENGINE_ORGAN_GOVERNED_PROOF.md"
    ],
    "posture": "governed",
    "target_bundles": [
      "docs/proof/platform/INVARIANT_ENGINE_ORGAN_V1_PROOF.md"
    ]
  },
  "lineage": {
    "parents": [
      "realtime_event_cause_predictor_organ",
      "continuity_witness_organ"
    ],
    "children": []
  },
  "activation": {
    "order": 3,
    "batch_id": "alt9-summon-wave-2026-06",
    "notes": "Alt-9 wave 3 \u2014 invariant consumer plane"
  },
  "retirement": {
    "path": "docs/contracts/AAIS_SUBSYSTEM_RETIREMENT_PROTOCOL.md"
  },
  "mutation": {
    "history": []
  },
  "ssp": {
    "concept_spec": "docs/_future/ideas_pending/INVARIANT_ENGINE_ORGAN.md",
    "mvp_plan": "docs/_future/ideas_pending/INVARIANT_ENGINE_ORGAN_MVP_PLAN.md",
    "summon_eligible": false,
    "active_doc": "docs/subsystems/platform/INVARIANT_ENGINE_ORGAN.md"
  }
}
