{
  "subsystem_genome_version": "subsystem_genome.v1",
  "identity": {
    "gene": "deliberation_organ",
    "version": "0.1.0-concept",
    "stage": "governed",
    "display_name": "Deliberation Organ"
  },
  "governance": {
    "contracts": [
      "docs/contracts/AAIS_SSP_PROTOCOL.md",
      "docs/contracts/AAIS_SSP_PROMOTION_PROTOCOL.md",
      "docs/contracts/AAIS_SUBSYSTEM_GENOME.md",
      "docs/runtime/NOVA_CORTEX.md",
      "docs/contracts/AAIS_SUBSYSTEM_MUTATION_PATH.md",
      "docs/contracts/AAIS_SUBSYSTEM_RETIREMENT_PROTOCOL.md"
    ],
    "invariants": [
      "Read-only v1 \u2014 organ does not mutate upstream authority",
      "module_id frozen to AAIS-DLO-01"
    ]
  },
  "schema": {
    "ref": "schemas/deliberation_organ.v1.json",
    "frozen": true
  },
  "runtime": {
    "surface": [
      {
        "kind": "module",
        "path": "src/deliberation_organ.py"
      },
      {
        "kind": "api",
        "path": "GET /api/jarvis/deliberation/status"
      },
      {
        "kind": "gate",
        "path": "make deliberation-organ-gate"
      }
    ]
  },
  "proof": {
    "bundles": [
      "docs/proof/nova/DELIBERATION_ORGAN_GOVERNED_PROOF.md"
    ],
    "posture": "governed",
    "target_bundles": [
      "docs/proof/cognitive_runtime/DELIBERATION_ORGAN_V1_PROOF.md"
    ]
  },
  "lineage": {
    "parents": [
      "coherence_projection_organ",
      "route_choice_organ"
    ],
    "children": [
      "planning_organ"
    ]
  },
  "activation": {
    "order": 4,
    "batch_id": "alt15-summon-wave-2026-06",
    "notes": "Alt-15 wave 4"
  },
  "retirement": {
    "path": "docs/contracts/AAIS_SUBSYSTEM_RETIREMENT_PROTOCOL.md"
  },
  "mutation": {
    "history": []
  },
  "ssp": {
    "concept_spec": "docs/_future/ideas_pending/DELIBERATION_ORGAN.md",
    "mvp_plan": "docs/_future/ideas_pending/DELIBERATION_ORGAN_MVP_PLAN.md",
    "summon_eligible": false,
    "active_doc": "docs/subsystems/nova/DELIBERATION_ORGAN.md"
  }
}
