{
  "subsystem_genome_version": "subsystem_genome.v1",
  "identity": {
    "gene": "mystic_engine_organ",
    "version": "0.1.0-concept",
    "stage": "governed",
    "display_name": "Mystic Engine Organ"
  },
  "governance": {
    "contracts": [
      "docs/contracts/AAIS_SSP_PROTOCOL.md",
      "docs/contracts/AAIS_SSP_PROMOTION_PROTOCOL.md",
      "docs/contracts/AAIS_SUBSYSTEM_GENOME.md",
      "docs/contracts/AAIS_SUBSYSTEM_MUTATION_PATH.md",
      "docs/contracts/AAIS_SUBSYSTEM_RETIREMENT_PROTOCOL.md"
    ],
    "invariants": [
      "Read-only v1 \u2014 organ does not mutate upstream authority",
      "module_id frozen to AAIS-MEO-01"
    ]
  },
  "schema": {
    "ref": "schemas/mystic_engine_organ.v1.json",
    "frozen": true
  },
  "runtime": {
    "surface": [
      {
        "kind": "module",
        "path": "src/mystic_engine_organ.py"
      },
      {
        "kind": "api",
        "path": "GET /api/jarvis/mystic-engine/status"
      },
      {
        "kind": "gate",
        "path": "make mystic-engine-organ-gate"
      }
    ]
  },
  "proof": {
    "bundles": [
      "docs/proof/platform/MYSTIC_ENGINE_ORGAN_GOVERNED_PROOF.md"
    ],
    "posture": "governed",
    "target_bundles": [
      "docs/proof/platform/MYSTIC_ENGINE_ORGAN_V1_PROOF.md"
    ]
  },
  "lineage": {
    "parents": [
      "spatial_reasoning_organ"
    ],
    "children": [
      "perception_lane_organ"
    ]
  },
  "activation": {
    "order": 5,
    "batch_id": "alt14-summon-wave-2026-06",
    "notes": "Alt-14 wave 5"
  },
  "retirement": {
    "path": "docs/contracts/AAIS_SUBSYSTEM_RETIREMENT_PROTOCOL.md"
  },
  "mutation": {
    "history": []
  },
  "ssp": {
    "concept_spec": "docs/_future/ideas_pending/MYSTIC_ENGINE_ORGAN.md",
    "mvp_plan": "docs/_future/ideas_pending/MYSTIC_ENGINE_ORGAN_MVP_PLAN.md",
    "summon_eligible": false,
    "active_doc": "docs/subsystems/platform/MYSTIC_ENGINE_ORGAN.md"
  }
}
