{
  "subsystem_genome_version": "subsystem_genome.v1",
  "identity": {
    "gene": "safety_envelope_organ",
    "version": "0.1.1",
    "stage": "governed",
    "display_name": "Safety Envelope Organ"
  },
  "governance": {
    "contracts": [
      "docs/contracts/AAIS_SSP_PROTOCOL.md",
      "docs/contracts/AAIS_SSP_PROMOTION_PROTOCOL.md",
      "docs/contracts/AAIS_SUBSYSTEM_GENOME.md",
      "docs/contracts/SWARM_LAW.md",
      "docs/contracts/AAIS_SUBSYSTEM_MUTATION_PATH.md",
      "docs/contracts/AAIS_SUBSYSTEM_RETIREMENT_PROTOCOL.md"
    ],
    "invariants": [
      "Read-only v1 \u2014 no write path from envelope organ",
      "halt_required blocks optimistic execution when wired to bridge",
      "Thresholds align with SWARM_LAW no-improvisation doctrine",
      "Envelope threshold mutations require MP-X and post-apply alt7-governed-gate"
    ]
  },
  "schema": {
    "ref": "schemas/safety_envelope_organ.v1.json",
    "frozen": true
  },
  "runtime": {
    "surface": [
      {
        "kind": "module",
        "path": "src/safety_envelope.py"
      },
      {
        "kind": "api",
        "path": "GET /api/jarvis/safety-envelope/status"
      },
      {
        "kind": "gate",
        "path": "make safety-envelope-gate"
      }
    ]
  },
  "proof": {
    "bundles": [
      "docs/proof/platform/SAFETY_ENVELOPE_V1_PROOF.md"
    ],
    "posture": "governed",
    "target_bundles": [
      "docs/proof/platform/SAFETY_ENVELOPE_V1_PROOF.md"
    ]
  },
  "lineage": {
    "parents": [
      "jarvis",
      "immune_system"
    ],
    "children": [
      "cognitive_bridge_organ",
      "immune_observe_organ",
      "operator_cognition_coherence_fabric",
      "reflection_runtime_organ"
    ]
  },
  "activation": {
    "order": 1,
    "batch_id": "alt5-summon-wave-2026-06",
    "notes": "Alt-5 wave 1 \u2014 foundational guard"
  },
  "retirement": {
    "path": "docs/contracts/AAIS_SUBSYSTEM_RETIREMENT_PROTOCOL.md"
  },
  "mutation": {
    "history": [
      {
        "proposal_id": "MP-SE-001",
        "status": "promoted",
        "schema_delta_ref": "schemas/deltas/safety_envelope_organ_MP-SE-001.json",
        "notes": "backup: .runtime\\governance\\mutation_backups\\safety_envelope_organ_20260603T001120Z.genome.v1.json"
      }
    ]
  },
  "ssp": {
    "concept_spec": "docs/_future/ideas_pending/SAFETY_ENVELOPE_ORGAN.md",
    "mvp_plan": "docs/_future/ideas_pending/SAFETY_ENVELOPE_ORGAN_MVP_PLAN.md",
    "summon_eligible": false,
    "active_doc": "docs/subsystems/platform/SAFETY_ENVELOPE_ORGAN.md"
  }
}
