{
  "subsystem_genome_version": "subsystem_genome.v1",
  "identity": {
    "gene": "phase_gate_organ",
    "version": "0.1.0-concept",
    "stage": "governed",
    "display_name": "Phase Gate Organ"
  },
  "governance": {
    "contracts": [
      "docs/contracts/AAIS_SSP_PROTOCOL.md",
      "docs/contracts/AAIS_SSP_PROMOTION_PROTOCOL.md",
      "docs/contracts/AAIS_SUBSYSTEM_GENOME.md",
      "docs/contracts/AAIS_MODULE_GOVERNANCE_PROTOCOL.md",
      "docs/contracts/AAIS_SUBSYSTEM_MUTATION_PATH.md",
      "docs/contracts/AAIS_SUBSYSTEM_RETIREMENT_PROTOCOL.md"
    ],
    "invariants": [
      "Existence is not activation",
      "Read-only v1 \u2014 phase gate organ does not promote components",
      "module_id frozen to AAIS-PG-01"
    ]
  },
  "schema": {
    "ref": "schemas/phase_gate_organ.v1.json",
    "frozen": true
  },
  "runtime": {
    "surface": [
      {
        "kind": "module",
        "path": "src/phase_gate_organ.py"
      },
      {
        "kind": "api",
        "path": "GET /api/jarvis/phase-gate/status"
      },
      {
        "kind": "gate",
        "path": "make phase-gate-organ-gate"
      }
    ]
  },
  "proof": {
    "bundles": [
      "docs/proof/platform/PHASE_GATE_ORGAN_GOVERNED_PROOF.md"
    ],
    "posture": "governed",
    "target_bundles": [
      "docs/proof/platform/PHASE_GATE_ORGAN_V1_PROOF.md"
    ]
  },
  "lineage": {
    "parents": [
      "capability_service_bridge",
      "governed_direct_pipeline"
    ],
    "children": [
      "capability_module_organ",
      "governed_event_chain_organ",
      "policy_gate_organ",
      "realtime_event_cause_predictor_organ"
    ]
  },
  "activation": {
    "order": 1,
    "batch_id": "alt9-summon-wave-2026-06",
    "notes": "Alt-9 wave 1 \u2014 admission fabric"
  },
  "retirement": {
    "path": "docs/contracts/AAIS_SUBSYSTEM_RETIREMENT_PROTOCOL.md"
  },
  "mutation": {
    "history": []
  },
  "ssp": {
    "concept_spec": "docs/_future/ideas_pending/PHASE_GATE_ORGAN.md",
    "mvp_plan": "docs/_future/ideas_pending/PHASE_GATE_ORGAN_MVP_PLAN.md",
    "summon_eligible": false,
    "active_doc": "docs/subsystems/platform/PHASE_GATE_ORGAN.md"
  }
}
