{
  "subsystem_genome_version": "subsystem_genome.v1",
  "identity": {
    "gene": "forensic_triangulation_organ",
    "version": "0.1.0-concept",
    "stage": "governed",
    "display_name": "Forensic Triangulation Organ"
  },
  "governance": {
    "contracts": [
      "docs/contracts/AAIS_SSP_PROTOCOL.md",
      "docs/contracts/AAIS_SSP_PROMOTION_PROTOCOL.md",
      "docs/contracts/AAIS_SUBSYSTEM_GENOME.md",
      "docs/contracts/AAIS_SUBSYSTEM_MUTATION_PATH.md",
      "docs/contracts/AAIS_SUBSYSTEM_RETIREMENT_PROTOCOL.md"
    ],
    "invariants": [
      "Read-only v1 \u2014 organ does not mutate upstream authority",
      "module_id frozen to AAIS-FT-01"
    ]
  },
  "schema": {
    "ref": "schemas/forensic_triangulation_organ.v1.json",
    "frozen": true
  },
  "runtime": {
    "surface": [
      {
        "kind": "module",
        "path": "src/forensic_triangulation_organ.py"
      },
      {
        "kind": "api",
        "path": "GET /api/jarvis/forensic-triangulation/status"
      },
      {
        "kind": "gate",
        "path": "make forensic-triangulation-organ-gate"
      }
    ]
  },
  "proof": {
    "bundles": [
      "docs/proof/forensics/FORENSIC_TRIANGULATION_ORGAN_GOVERNED_PROOF.md"
    ],
    "posture": "governed",
    "target_bundles": [
      "docs/proof/forensics/FORENSIC_TRIANGULATION_ORGAN_V1_PROOF.md"
    ]
  },
  "lineage": {
    "parents": [
      "mechanic_handoff_organ",
      "forensic_triangulation"
    ],
    "children": [
      "slingshot_organ"
    ]
  },
  "activation": {
    "order": 6,
    "batch_id": "alt10-summon-wave-2026-06",
    "notes": "Alt-10 wave 6"
  },
  "retirement": {
    "path": "docs/contracts/AAIS_SUBSYSTEM_RETIREMENT_PROTOCOL.md"
  },
  "mutation": {
    "history": []
  },
  "ssp": {
    "concept_spec": "docs/_future/ideas_pending/FORENSIC_TRIANGULATION_ORGAN.md",
    "mvp_plan": "docs/_future/ideas_pending/FORENSIC_TRIANGULATION_ORGAN_MVP_PLAN.md",
    "summon_eligible": false,
    "active_doc": "docs/subsystems/forensics/FORENSIC_TRIANGULATION_ORGAN.md"
  }
}
