{
  "subsystem_genome_version": "subsystem_genome.v1",
  "identity": {
    "gene": "perception_gateway_organ",
    "version": "0.1.0-concept",
    "stage": "governed",
    "display_name": "Perception Gateway Organ"
  },
  "governance": {
    "contracts": [
      "docs/contracts/AAIS_SSP_PROTOCOL.md",
      "docs/contracts/AAIS_SSP_PROMOTION_PROTOCOL.md",
      "docs/contracts/AAIS_SUBSYSTEM_GENOME.md",
      "docs/contracts/AAIS_SUBSYSTEM_MUTATION_PATH.md",
      "docs/contracts/AAIS_SUBSYSTEM_RETIREMENT_PROTOCOL.md"
    ],
    "invariants": [
      "Read-only v1 \u2014 organ does not mutate upstream authority",
      "module_id frozen to AAIS-PGO-01"
    ]
  },
  "schema": {
    "ref": "schemas/perception_gateway_organ.v1.json",
    "frozen": true
  },
  "runtime": {
    "surface": [
      {
        "kind": "module",
        "path": "src/perception_gateway_organ.py"
      },
      {
        "kind": "api",
        "path": "GET /api/jarvis/perception-gateway/status"
      },
      {
        "kind": "gate",
        "path": "make perception-gateway-organ-gate"
      }
    ]
  },
  "proof": {
    "bundles": [
      "docs/proof/platform/PERCEPTION_GATEWAY_ORGAN_GOVERNED_PROOF.md"
    ],
    "posture": "governed",
    "target_bundles": [
      "docs/proof/platform/PERCEPTION_GATEWAY_ORGAN_V1_PROOF.md"
    ]
  },
  "lineage": {
    "parents": [
      "ui_vision_organ",
      "capability_module_organ"
    ],
    "children": [
      "spatial_reasoning_organ"
    ]
  },
  "activation": {
    "order": 3,
    "batch_id": "alt14-summon-wave-2026-06",
    "notes": "Alt-14 wave 3"
  },
  "retirement": {
    "path": "docs/contracts/AAIS_SUBSYSTEM_RETIREMENT_PROTOCOL.md"
  },
  "mutation": {
    "history": []
  },
  "ssp": {
    "concept_spec": "docs/_future/ideas_pending/PERCEPTION_GATEWAY_ORGAN.md",
    "mvp_plan": "docs/_future/ideas_pending/PERCEPTION_GATEWAY_ORGAN_MVP_PLAN.md",
    "summon_eligible": false,
    "active_doc": "docs/subsystems/platform/PERCEPTION_GATEWAY_ORGAN.md"
  }
}
