{
  "subsystem_genome_version": "subsystem_genome.v1",
  "identity": {
    "gene": "cognitive_bridge_organ",
    "version": "0.1.0-concept",
    "stage": "governed",
    "display_name": "Cognitive Bridge Organ"
  },
  "governance": {
    "contracts": [
      "docs/contracts/AAIS_SSP_PROTOCOL.md",
      "docs/contracts/AAIS_SSP_PROMOTION_PROTOCOL.md",
      "docs/contracts/AAIS_SUBSYSTEM_GENOME.md",
      "docs/contracts/AAIS_SUBSYSTEM_MUTATION_PATH.md",
      "docs/contracts/AAIS_SUBSYSTEM_RETIREMENT_PROTOCOL.md"
    ],
    "invariants": [
      "Read-only v1 \u2014 organ does not mutate upstream authority",
      "module_id frozen to AAIS-CB-01"
    ]
  },
  "schema": {
    "ref": "schemas/cognitive_bridge_organ.v1.json",
    "frozen": true
  },
  "runtime": {
    "surface": [
      {
        "kind": "module",
        "path": "src/cognitive_bridge_organ.py"
      },
      {
        "kind": "api",
        "path": "GET /api/jarvis/cognitive-bridge/status"
      },
      {
        "kind": "gate",
        "path": "make cognitive-bridge-organ-gate"
      }
    ]
  },
  "proof": {
    "bundles": [
      "docs/proof/platform/COGNITIVE_BRIDGE_ORGAN_GOVERNED_PROOF.md"
    ],
    "posture": "governed",
    "target_bundles": [
      "docs/proof/platform/COGNITIVE_BRIDGE_ORGAN_V1_PROOF.md"
    ]
  },
  "lineage": {
    "parents": [
      "safety_envelope_organ",
      "operator_profile_organ",
      "governed_direct_pipeline"
    ],
    "children": [
      "aris_boundary_organ",
      "governed_event_chain_organ",
      "mission_board_organ",
      "tracing_spine_organ"
    ]
  },
  "activation": {
    "order": 1,
    "batch_id": "alt11-summon-wave-2026-06",
    "notes": "Alt-11 wave 1"
  },
  "retirement": {
    "path": "docs/contracts/AAIS_SUBSYSTEM_RETIREMENT_PROTOCOL.md"
  },
  "mutation": {
    "history": []
  },
  "ssp": {
    "concept_spec": "docs/_future/ideas_pending/COGNITIVE_BRIDGE_ORGAN.md",
    "mvp_plan": "docs/_future/ideas_pending/COGNITIVE_BRIDGE_ORGAN_MVP_PLAN.md",
    "summon_eligible": false,
    "active_doc": "docs/subsystems/platform/COGNITIVE_BRIDGE_ORGAN.md"
  }
}
