{
  "subsystem_genome_version": "subsystem_genome.v1",
  "identity": {
    "gene": "linguistic_work_order_history_organ",
    "version": "0.1.0-concept",
    "stage": "concept",
    "display_name": "Linguistic Work Order History Subsystem"
  },
  "governance": {
    "contracts": [
      "docs/contracts/AAIS_SSP_PROTOCOL.md",
      "docs/contracts/AAIS_SSP_PROMOTION_PROTOCOL.md",
      "docs/contracts/AAIS_SUBSYSTEM_GENOME.md",
      "docs/contracts/AAIS_META_LINGUISTIC_GOVERNANCE.md",
      "docs/contracts/AAIS_CODEX_CURSOR_NAMING_PROTOCOL.md",
      "docs/runtime/AAIS_RUNTIME_GUIDE.md"
    ],
    "invariants": [
      "Read-only v1 \u2014 subsystem does not mutate upstream authority",
      "module_id frozen to AAIS-LWOH-01"
    ]
  },
  "schema": {
    "ref": "schemas/linguistic_work_order_history_organ.v1.json",
    "frozen": false
  },
  "runtime": {
    "surface": []
  },
  "proof": {
    "bundles": [],
    "posture": "asserted",
    "target_bundles": [
      "docs/proof/platform/LINGUISTIC_WORK_ORDER_HISTORY_ORGAN_V1_PROOF.md"
    ]
  },
  "lineage": {
    "parents": [
      "linguistic_governance_work_order_organ"
    ],
    "children": []
  },
  "activation": {
    "order": 2,
    "batch_id": "alt26-summon-wave-2026-06",
    "notes": "Release 26 wave 2"
  },
  "retirement": {
    "path": "docs/contracts/AAIS_SUBSYSTEM_RETIREMENT_PROTOCOL.md"
  },
  "mutation": {
    "history": []
  },
  "ssp": {
    "concept_spec": "docs/_future/ideas_pending/LINGUISTIC_WORK_ORDER_HISTORY_ORGAN.md",
    "mvp_plan": "docs/_future/ideas_pending/LINGUISTIC_WORK_ORDER_HISTORY_ORGAN_MVP_PLAN.md",
    "summon_eligible": true
  }
}
