{
  "subsystem_genome_version": "subsystem_genome.v1",
  "identity": {
    "gene": "verification_gate_organ",
    "version": "0.1.0-concept",
    "stage": "governed",
    "display_name": "Verification Gate Organ"
  },
  "governance": {
    "contracts": [
      "docs/contracts/AAIS_SSP_PROTOCOL.md",
      "docs/contracts/AAIS_SSP_PROMOTION_PROTOCOL.md",
      "docs/contracts/AAIS_SUBSYSTEM_GENOME.md",
      "docs/contracts/AAIS_SUBSYSTEM_MUTATION_PATH.md",
      "docs/contracts/AAIS_SUBSYSTEM_RETIREMENT_PROTOCOL.md"
    ],
    "invariants": [
      "Read-only v1 \u2014 organ does not mutate upstream authority",
      "module_id frozen to AAIS-VG-01"
    ]
  },
  "schema": {
    "ref": "schemas/verification_gate_organ.v1.json",
    "frozen": true
  },
  "runtime": {
    "surface": [
      {
        "kind": "module",
        "path": "src/verification_gate_organ.py"
      },
      {
        "kind": "api",
        "path": "GET /api/jarvis/verification-gate/status"
      },
      {
        "kind": "gate",
        "path": "make verification-gate-organ-gate"
      }
    ]
  },
  "proof": {
    "bundles": [
      "docs/proof/platform/VERIFICATION_GATE_ORGAN_GOVERNED_PROOF.md"
    ],
    "posture": "governed",
    "target_bundles": [
      "docs/proof/platform/VERIFICATION_GATE_ORGAN_V1_PROOF.md"
    ]
  },
  "lineage": {
    "parents": [
      "jarvis_memory_board",
      "capability_service_bridge"
    ],
    "children": [
      "memory_path_governance_organ",
      "mission_board_organ"
    ]
  },
  "activation": {
    "order": 1,
    "batch_id": "alt10-summon-wave-2026-06",
    "notes": "Alt-10 wave 1"
  },
  "retirement": {
    "path": "docs/contracts/AAIS_SUBSYSTEM_RETIREMENT_PROTOCOL.md"
  },
  "mutation": {
    "history": []
  },
  "ssp": {
    "concept_spec": "docs/_future/ideas_pending/VERIFICATION_GATE_ORGAN.md",
    "mvp_plan": "docs/_future/ideas_pending/VERIFICATION_GATE_ORGAN_MVP_PLAN.md",
    "summon_eligible": false,
    "active_doc": "docs/subsystems/platform/VERIFICATION_GATE_ORGAN.md"
  }
}
