{
  "subsystem_genome_version": "subsystem_genome.v1",
  "identity": {
    "gene": "jarvis_memory_board",
    "version": "0.1.0-concept",
    "stage": "governed",
    "display_name": "Jarvis Memory Board"
  },
  "governance": {
    "contracts": [
      "docs/contracts/AAIS_SSP_PROTOCOL.md",
      "docs/contracts/AAIS_SSP_PROMOTION_PROTOCOL.md",
      "docs/contracts/AAIS_SUBSYSTEM_GENOME.md",
      "docs/contracts/JARVIS_MEMORY_BOARD_DOCTRINE.md",
      "docs/contracts/JARVIS_PROTOCOL.md",
      "docs/contracts/AAIS_SUBSYSTEM_MUTATION_PATH.md",
      "docs/contracts/AAIS_SUBSYSTEM_RETIREMENT_PROTOCOL.md"
    ],
    "invariants": [
      "controller_approved required for every slot install",
      "supported_slot must match target slot id",
      "Migrations preserve trust class and slot role"
    ]
  },
  "schema": {
    "ref": "schemas/jarvis_memory_board.v1.json",
    "frozen": true
  },
  "runtime": {
    "surface": [
      {
        "kind": "module",
        "path": "src/jarvis_memory_board.py"
      },
      {
        "kind": "api",
        "path": "GET /api/jarvis/memory/board"
      },
      {
        "kind": "gate",
        "path": "make memory-board-gate"
      }
    ]
  },
  "proof": {
    "bundles": [
      "docs/proof/platform/JARVIS_MEMORY_BOARD_V1_PROOF.md"
    ],
    "posture": "governed",
    "target_bundles": [
      "docs/proof/platform/JARVIS_MEMORY_BOARD_V1_PROOF.md"
    ]
  },
  "lineage": {
    "parents": [],
    "children": [
      "cisiv_operator_lineage_console",
      "governed_direct_pipeline",
      "operator_cognition_coherence_fabric"
    ]
  },
  "activation": {
    "order": 2,
    "batch_id": "barebones-summon-wave-2026-06",
    "notes": "Barebones wave \u2014 memory governance fabric"
  },
  "retirement": {
    "path": "docs/contracts/AAIS_SUBSYSTEM_RETIREMENT_PROTOCOL.md"
  },
  "mutation": {
    "history": []
  },
  "ssp": {
    "concept_spec": "docs/_future/ideas_pending/JARVIS_MEMORY_BOARD.md",
    "mvp_plan": "docs/_future/ideas_pending/JARVIS_MEMORY_BOARD_MVP_PLAN.md",
    "summon_eligible": false,
    "active_doc": "docs/subsystems/platform/JARVIS_MEMORY_BOARD.md"
  }
}
