{
  "subsystem_genome_version": "subsystem_genome.v1",
  "identity": {
    "gene": "intent_agency_organ",
    "version": "0.1.0-concept",
    "stage": "governed",
    "display_name": "Intent Agency Organ"
  },
  "governance": {
    "contracts": [
      "docs/contracts/AAIS_SSP_PROTOCOL.md",
      "docs/contracts/AAIS_SSP_PROMOTION_PROTOCOL.md",
      "docs/contracts/AAIS_SUBSYSTEM_GENOME.md",
      "docs/runtime/NOVA_INTENT_CORE.md",
      "docs/contracts/AAIS_SUBSYSTEM_MUTATION_PATH.md",
      "docs/contracts/AAIS_SUBSYSTEM_RETIREMENT_PROTOCOL.md"
    ],
    "invariants": [
      "Read-only v1 \u2014 intent agency organ does not authorize execution",
      "Claim postures limited to asserted, proven, rejected",
      "Agency preservation constitutional values respected"
    ]
  },
  "schema": {
    "ref": "schemas/intent_agency_organ.v1.json",
    "frozen": true
  },
  "runtime": {
    "surface": [
      {
        "kind": "module",
        "path": "src/intent_agency_organ.py"
      },
      {
        "kind": "api",
        "path": "GET /api/jarvis/intent-agency/status"
      },
      {
        "kind": "gate",
        "path": "make intent-agency-gate"
      }
    ]
  },
  "proof": {
    "bundles": [
      "docs/proof/cognitive_runtime/INTENT_AGENCY_ORGAN_GOVERNED_PROOF.md"
    ],
    "posture": "governed",
    "target_bundles": [
      "docs/proof/cognitive_runtime/INTENT_AGENCY_ORGAN_V1_PROOF.md"
    ]
  },
  "lineage": {
    "parents": [
      "narrative_continuity_organ",
      "reflection_runtime_organ"
    ],
    "children": []
  },
  "activation": {
    "order": 3,
    "batch_id": "alt8-summon-wave-2026-06",
    "notes": "Alt-8 wave 3 \u2014 intent agency plane"
  },
  "retirement": {
    "path": "docs/contracts/AAIS_SUBSYSTEM_RETIREMENT_PROTOCOL.md"
  },
  "mutation": {
    "history": []
  },
  "ssp": {
    "concept_spec": "docs/_future/ideas_pending/INTENT_AGENCY_ORGAN.md",
    "mvp_plan": "docs/_future/ideas_pending/INTENT_AGENCY_ORGAN_MVP_PLAN.md",
    "summon_eligible": false,
    "active_doc": "docs/subsystems/nova/INTENT_AGENCY_ORGAN.md"
  }
}
