{
  "subsystem_genome_version": "subsystem_genome.v1",
  "identity": {
    "gene": "reasoning_executive_organ",
    "version": "0.1.0-concept",
    "stage": "governed",
    "display_name": "Reasoning Executive Organ"
  },
  "governance": {
    "contracts": [
      "docs/contracts/AAIS_SSP_PROTOCOL.md",
      "docs/contracts/AAIS_SSP_PROMOTION_PROTOCOL.md",
      "docs/contracts/AAIS_SUBSYSTEM_GENOME.md",
      "docs/runtime/NOVA_CORTEX.md",
      "docs/contracts/AAIS_SUBSYSTEM_MUTATION_PATH.md",
      "docs/contracts/AAIS_SUBSYSTEM_RETIREMENT_PROTOCOL.md"
    ],
    "invariants": [
      "Read-only v1 \u2014 organ does not mutate upstream authority",
      "module_id frozen to AAIS-REO-01"
    ]
  },
  "schema": {
    "ref": "schemas/reasoning_executive_organ.v1.json",
    "frozen": true
  },
  "runtime": {
    "surface": [
      {
        "kind": "module",
        "path": "src/reasoning_executive_organ.py"
      },
      {
        "kind": "api",
        "path": "GET /api/jarvis/reasoning-executive/status"
      },
      {
        "kind": "gate",
        "path": "make reasoning-executive-organ-gate"
      }
    ]
  },
  "proof": {
    "bundles": [
      "docs/proof/nova/REASONING_EXECUTIVE_ORGAN_V1_PROOF.md"
    ],
    "posture": "governed",
    "target_bundles": [
      "docs/proof/cognitive_runtime/REASONING_EXECUTIVE_ORGAN_V1_PROOF.md"
    ]
  },
  "lineage": {
    "parents": [
      "operator_profile_organ",
      "safety_envelope_organ",
      "operator_cognition_coherence_fabric"
    ],
    "children": [
      "attention_organ"
    ]
  },
  "activation": {
    "order": 1,
    "batch_id": "alt15-summon-wave-2026-06",
    "notes": "Alt-15 wave 1"
  },
  "retirement": {
    "path": "docs/contracts/AAIS_SUBSYSTEM_RETIREMENT_PROTOCOL.md"
  },
  "mutation": {
    "history": []
  },
  "ssp": {
    "concept_spec": "docs/_future/ideas_pending/REASONING_EXECUTIVE_ORGAN.md",
    "mvp_plan": "docs/_future/ideas_pending/REASONING_EXECUTIVE_ORGAN_MVP_PLAN.md",
    "summon_eligible": false,
    "active_doc": "docs/subsystems/nova/REASONING_EXECUTIVE_ORGAN.md"
  }
}
