{
  "subsystem_genome_version": "subsystem_genome.v1",
  "identity": {
    "gene": "linguistic_full_governance_cycle_organ",
    "version": "0.1.0-governed",
    "stage": "governed",
    "display_name": "Linguistic Full Governance Cycle Subsystem"
  },
  "governance": {
    "contracts": [
      "docs/contracts/AAIS_SSP_PROTOCOL.md",
      "docs/contracts/AAIS_SSP_PROMOTION_PROTOCOL.md",
      "docs/contracts/AAIS_SUBSYSTEM_GENOME.md",
      "docs/contracts/AAIS_META_LINGUISTIC_GOVERNANCE.md",
      "docs/contracts/AAIS_CODEX_CURSOR_NAMING_PROTOCOL.md",
      "docs/runtime/AAIS_RUNTIME_GUIDE.md",
      "docs/contracts/AAIS_SUBSYSTEM_MUTATION_PATH.md",
      "docs/contracts/AAIS_SUBSYSTEM_RETIREMENT_PROTOCOL.md"
    ],
    "invariants": [
      "Read-only v1 \u2014 subsystem does not mutate upstream authority",
      "module_id frozen to AAIS-LFG-01"
    ]
  },
  "schema": {
    "ref": "schemas/linguistic_full_governance_cycle_organ.v1.json",
    "frozen": true
  },
  "runtime": {
    "surface": [
      {
        "kind": "module",
        "path": "src/linguistic_full_governance_cycle_organ.py"
      },
      {
        "kind": "api",
        "path": "GET /api/jarvis/linguistic-full-governance-cycle/status"
      },
      {
        "kind": "gate",
        "path": "make linguistic-full-governance-cycle-organ-gate"
      }
    ]
  },
  "proof": {
    "bundles": [
      "docs/proof/platform/LINGUISTIC_FULL_GOVERNANCE_CYCLE_ORGAN_GOVERNED_PROOF.md"
    ],
    "posture": "governed",
    "target_bundles": [
      "docs/proof/platform/LINGUISTIC_FULL_GOVERNANCE_CYCLE_ORGAN_V1_PROOF.md"
    ]
  },
  "lineage": {
    "parents": [
      "linguistic_forecast_calibration_organ",
      "linguistic_governance_queue_organ",
      "linguistic_predictive_governance_organ",
      "linguistic_governance_cycle_organ"
    ],
    "children": [
      "linguistic_governance_attestation_organ"
    ]
  },
  "activation": {
    "order": 3,
    "batch_id": "alt24-summon-wave-2026-06",
    "notes": "Release 24 wave 3"
  },
  "retirement": {
    "path": "docs/contracts/AAIS_SUBSYSTEM_RETIREMENT_PROTOCOL.md"
  },
  "mutation": {
    "history": []
  },
  "ssp": {
    "concept_spec": "docs/_future/ideas_pending/LINGUISTIC_FULL_GOVERNANCE_CYCLE_ORGAN.md",
    "mvp_plan": "docs/_future/ideas_pending/LINGUISTIC_FULL_GOVERNANCE_CYCLE_ORGAN_MVP_PLAN.md",
    "summon_eligible": false,
    "active_doc": "docs/subsystems/platform/LINGUISTIC_FULL_GOVERNANCE_CYCLE_ORGAN.md"
  }
}
