{
  "subsystem_genome_version": "subsystem_genome.v1",
  "identity": {
    "gene": "coherence_projection_organ",
    "version": "0.1.0-concept",
    "stage": "governed",
    "display_name": "Coherence Projection Organ"
  },
  "governance": {
    "contracts": [
      "docs/contracts/AAIS_SSP_PROTOCOL.md",
      "docs/contracts/AAIS_SSP_PROMOTION_PROTOCOL.md",
      "docs/contracts/AAIS_SUBSYSTEM_GENOME.md",
      "docs/runtime/NOVA_CORTEX.md",
      "docs/contracts/AAIS_SUBSYSTEM_MUTATION_PATH.md",
      "docs/contracts/AAIS_SUBSYSTEM_RETIREMENT_PROTOCOL.md"
    ],
    "invariants": [
      "Read-only v1 \u2014 organ does not mutate upstream authority",
      "module_id frozen to AAIS-CPO-01"
    ]
  },
  "schema": {
    "ref": "schemas/coherence_projection_organ.v1.json",
    "frozen": true
  },
  "runtime": {
    "surface": [
      {
        "kind": "module",
        "path": "src/coherence_projection_organ.py"
      },
      {
        "kind": "api",
        "path": "GET /api/jarvis/coherence-projection/status"
      },
      {
        "kind": "gate",
        "path": "make coherence-projection-organ-gate"
      }
    ]
  },
  "proof": {
    "bundles": [
      "docs/proof/nova/COHERENCE_PROJECTION_ORGAN_GOVERNED_PROOF.md"
    ],
    "posture": "governed",
    "target_bundles": [
      "docs/proof/cognitive_runtime/COHERENCE_PROJECTION_ORGAN_V1_PROOF.md"
    ]
  },
  "lineage": {
    "parents": [
      "attention_organ",
      "narrative_continuity_organ",
      "intent_agency_organ"
    ],
    "children": [
      "deliberation_organ",
      "speaking_runtime_organ"
    ]
  },
  "activation": {
    "order": 3,
    "batch_id": "alt15-summon-wave-2026-06",
    "notes": "Alt-15 wave 3"
  },
  "retirement": {
    "path": "docs/contracts/AAIS_SUBSYSTEM_RETIREMENT_PROTOCOL.md"
  },
  "mutation": {
    "history": []
  },
  "ssp": {
    "concept_spec": "docs/_future/ideas_pending/COHERENCE_PROJECTION_ORGAN.md",
    "mvp_plan": "docs/_future/ideas_pending/COHERENCE_PROJECTION_ORGAN_MVP_PLAN.md",
    "summon_eligible": false,
    "active_doc": "docs/subsystems/nova/COHERENCE_PROJECTION_ORGAN.md"
  }
}
