{
  "subsystem_genome_version": "subsystem_genome.v1",
  "identity": {
    "gene": "cortex_arcs_organ",
    "version": "0.1.0-concept",
    "stage": "governed",
    "display_name": "Cortex Arcs Organ"
  },
  "governance": {
    "contracts": [
      "docs/contracts/AAIS_SSP_PROTOCOL.md",
      "docs/contracts/AAIS_SSP_PROMOTION_PROTOCOL.md",
      "docs/contracts/AAIS_SUBSYSTEM_GENOME.md",
      "docs/runtime/NOVA_CORTEX.md",
      "docs/contracts/AAIS_SUBSYSTEM_MUTATION_PATH.md",
      "docs/contracts/AAIS_SUBSYSTEM_RETIREMENT_PROTOCOL.md"
    ],
    "invariants": [
      "Read-only v1 \u2014 organ does not mutate upstream authority",
      "module_id frozen to AAIS-CAO-01"
    ]
  },
  "schema": {
    "ref": "schemas/cortex_arcs_organ.v1.json",
    "frozen": true
  },
  "runtime": {
    "surface": [
      {
        "kind": "module",
        "path": "src/cortex_arcs_organ.py"
      },
      {
        "kind": "api",
        "path": "GET /api/jarvis/cortex-arcs/status"
      },
      {
        "kind": "gate",
        "path": "make cortex-arcs-organ-gate"
      }
    ]
  },
  "proof": {
    "bundles": [
      "docs/proof/nova/CORTEX_ARCS_ORGAN_GOVERNED_PROOF.md"
    ],
    "posture": "governed",
    "target_bundles": [
      "docs/proof/cognitive_runtime/CORTEX_ARCS_ORGAN_V1_PROOF.md"
    ]
  },
  "lineage": {
    "parents": [
      "planning_organ",
      "continuity_witness_organ"
    ],
    "children": [
      "cognitive_execution_organ"
    ]
  },
  "activation": {
    "order": 6,
    "batch_id": "alt15-summon-wave-2026-06",
    "notes": "Alt-15 wave 6"
  },
  "retirement": {
    "path": "docs/contracts/AAIS_SUBSYSTEM_RETIREMENT_PROTOCOL.md"
  },
  "mutation": {
    "history": []
  },
  "ssp": {
    "concept_spec": "docs/_future/ideas_pending/CORTEX_ARCS_ORGAN.md",
    "mvp_plan": "docs/_future/ideas_pending/CORTEX_ARCS_ORGAN_MVP_PLAN.md",
    "summon_eligible": false,
    "active_doc": "docs/subsystems/nova/CORTEX_ARCS_ORGAN.md"
  }
}
