{
  "subsystem_genome_version": "subsystem_genome.v1",
  "identity": {
    "gene": "cogos_runtime_bridge_organ",
    "version": "0.1.0-concept",
    "stage": "governed",
    "display_name": "CoGOS Runtime Bridge Organ"
  },
  "governance": {
    "contracts": [
      "docs/contracts/AAIS_SSP_PROTOCOL.md",
      "docs/contracts/AAIS_SSP_PROMOTION_PROTOCOL.md",
      "docs/contracts/AAIS_SUBSYSTEM_GENOME.md",
      "docs/runtime/AAIS_RUNTIME_GUIDE.md",
      "docs/contracts/AAIS_SUBSYSTEM_MUTATION_PATH.md",
      "docs/contracts/AAIS_SUBSYSTEM_RETIREMENT_PROTOCOL.md"
    ],
    "invariants": [
      "Read-only v1 \u2014 organ does not mutate upstream authority",
      "module_id frozen to AAIS-CRB-01"
    ]
  },
  "schema": {
    "ref": "schemas/cogos_runtime_bridge_organ.v1.json",
    "frozen": true
  },
  "runtime": {
    "surface": [
      {
        "kind": "module",
        "path": "src/cogos_runtime_bridge_organ.py"
      },
      {
        "kind": "api",
        "path": "GET /api/jarvis/cogos-runtime-bridge/status"
      },
      {
        "kind": "gate",
        "path": "make cogos-runtime-bridge-organ-gate"
      }
    ]
  },
  "proof": {
    "bundles": [
      "docs/proof/platform/COGOS_RUNTIME_BRIDGE_ORGAN_GOVERNED_PROOF.md"
    ],
    "posture": "governed",
    "target_bundles": [
      "docs/proof/platform/COGOS_RUNTIME_BRIDGE_ORGAN_V1_PROOF.md"
    ]
  },
  "lineage": {
    "parents": [
      "ai_factory_organ",
      "capability_service_bridge"
    ],
    "children": [
      "wolf_rehydration_organ"
    ]
  },
  "activation": {
    "order": 2,
    "batch_id": "alt16-summon-wave-2026-06",
    "notes": "Alt-16 wave 2"
  },
  "retirement": {
    "path": "docs/contracts/AAIS_SUBSYSTEM_RETIREMENT_PROTOCOL.md"
  },
  "mutation": {
    "history": []
  },
  "ssp": {
    "concept_spec": "docs/_future/ideas_pending/COGOS_RUNTIME_BRIDGE_ORGAN.md",
    "mvp_plan": "docs/_future/ideas_pending/COGOS_RUNTIME_BRIDGE_ORGAN_MVP_PLAN.md",
    "summon_eligible": false,
    "active_doc": "docs/subsystems/platform/COGOS_RUNTIME_BRIDGE_ORGAN.md"
  }
}
